{
  "schemaVersion": 1,
  "generatorVersion": "lobed-leaf-v1",
  "id": "plant-1",
  "seed": 8278,
  "rootBranchId": "plant-1:wood",
  "branches": [
    {
      "id": "plant-1:fork",
      "label": "leaf-bearing fork",
      "kind": "lateral",
      "parentId": "plant-1:wood",
      "parentDistance": 1.766888404939137,
      "points": [
        {
          "x": -0.2881605097141729,
          "y": 2.2925543761923084,
          "z": -0.025929519039919857
        },
        {
          "x": -0.14335368343932503,
          "y": 2.45714658627649,
          "z": -0.0013845515116091833
        },
        {
          "x": 0.0019383644064767946,
          "y": 2.6217038122709138,
          "z": 0.020368797493738332
        },
        {
          "x": 0.14756621204300868,
          "y": 2.7862188440864717,
          "z": 0.04010207615269931
        },
        {
          "x": 0.29335481587475826,
          "y": 2.950707884530811,
          "z": 0.058839913638514235
        },
        {
          "x": 0.43912887900378794,
          "y": 3.115199438949991,
          "z": 0.07766858939573763
        },
        {
          "x": 0.5847312121859969,
          "y": 3.2797182388876176,
          "z": 0.09755810990617995
        },
        {
          "x": 0.730044571085802,
          "y": 3.4442732479492686,
          "z": 0.11918551624932294
        }
      ],
      "restLengths": [
        0.22059480498677914,
        0.22059480498677916,
        0.2205948049867793,
        0.22059480498677903,
        0.22059480498677916,
        0.22059480498677905,
        0.22059480498677894
      ],
      "activeLength": 1.5441636349074537,
      "radius": 0.027,
      "stiffness": 0.49,
      "referenceNormal": {
        "x": -0.16711774519947864,
        "y": 0,
        "z": 0.9859369448597826
      },
      "active": true
    },
    {
      "id": "plant-1:petiole-1",
      "label": "lobed leaf stalk",
      "kind": "petiole",
      "parentId": "plant-1:wood",
      "parentDistance": 3.233029847335442,
      "points": [
        {
          "x": -0.5575909859893721,
          "y": 3.7336821765206696,
          "z": -0.02087412647119564
        },
        {
          "x": -0.4889799221782042,
          "y": 3.7601848825918927,
          "z": -0.003203457410056114
        },
        {
          "x": -0.4193646845642436,
          "y": 3.7838069147410818,
          "z": 0.014624675990852341
        },
        {
          "x": -0.35018019917532184,
          "y": 3.808709588601332,
          "z": 0.03238665413367707
        }
      ],
      "restLengths": [
        0.07564472256189528,
        0.07564472256189526,
        0.07564472256189522
      ],
      "activeLength": 0.22693416768568578,
      "radius": 0.011,
      "stiffness": 0.18,
      "referenceNormal": {
        "x": -0.24940938270685137,
        "y": 0,
        "z": 0.9683981411680772
      },
      "active": true
    },
    {
      "id": "plant-1:petiole-2",
      "label": "lobed leaf stalk",
      "kind": "petiole",
      "parentId": "plant-1:wood",
      "parentDistance": 3.233029847335442,
      "points": [
        {
          "x": -0.5575909859893721,
          "y": 3.7336821765206696,
          "z": -0.02087412647119564
        },
        {
          "x": -0.6331583609337089,
          "y": 3.7356871445297988,
          "z": -0.03937093380624891
        },
        {
          "x": -0.7087202619024535,
          "y": 3.7345508326509567,
          "z": -0.05796361654944992
        },
        {
          "x": -0.7842997935068077,
          "y": 3.734805605869225,
          "z": -0.07651757643297258
        }
      ],
      "restLengths": [
        0.07782403185575584,
        0.07782403185575576,
        0.07782403185575573
      ],
      "activeLength": 0.23347209556726733,
      "radius": 0.011,
      "stiffness": 0.18,
      "referenceNormal": {
        "x": 0.23775366474234938,
        "y": 0,
        "z": -0.9713254835026118
      },
      "active": true
    },
    {
      "id": "plant-1:petiole-3",
      "label": "lobed leaf stalk",
      "kind": "petiole",
      "parentId": "plant-1:fork",
      "parentDistance": 1.2353309079259631,
      "points": [
        {
          "x": 0.5264902789131133,
          "y": 3.213910718912567,
          "z": 0.08960230170200302
        },
        {
          "x": 0.5534298306736567,
          "y": 3.2189994553153354,
          "z": 0.01616198406990489
        },
        {
          "x": 0.5784306794078723,
          "y": 3.221719371353211,
          "z": -0.05808540349662902
        },
        {
          "x": 0.6042952361509037,
          "y": 3.2254890161366796,
          "z": -0.13199027088594442
        }
      ],
      "restLengths": [
        0.0783907835216572,
        0.07839078352165717,
        0.0783907835216572
      ],
      "activeLength": 0.23517235056497154,
      "radius": 0.011,
      "stiffness": 0.18,
      "referenceNormal": {
        "x": 0.9388290585939213,
        "y": 0,
        "z": 0.3443835053245892
      },
      "active": true
    },
    {
      "id": "plant-1:petiole-4",
      "label": "lobed leaf stalk",
      "kind": "petiole",
      "parentId": "plant-1:fork",
      "parentDistance": 1.2353309079259631,
      "points": [
        {
          "x": 0.5264902789131133,
          "y": 3.213910718912567,
          "z": 0.08960230170200302
        },
        {
          "x": 0.5190500804894075,
          "y": 3.2317082909796584,
          "z": 0.1683030988963673
        },
        {
          "x": 0.5093577927964765,
          "y": 3.2471454307134846,
          "z": 0.24725675542481235
        },
        {
          "x": 0.5006610342844215,
          "y": 3.263631143249261,
          "z": 0.3261143059616292
        }
      ],
      "restLengths": [
        0.08103039925297098,
        0.08103039925297105,
        0.08103039925297101
      ],
      "activeLength": 0.24309119775891302,
      "radius": 0.011,
      "stiffness": 0.18,
      "referenceNormal": {
        "x": -0.9955610368501313,
        "y": 0,
        "z": -0.09411812740323403
      },
      "active": true
    },
    {
      "id": "plant-1:wood",
      "label": "lobed-leaf wood",
      "kind": "trunk",
      "parentId": null,
      "parentDistance": 0,
      "points": [
        {
          "x": 0,
          "y": 0.55,
          "z": 0
        },
        {
          "x": -0.036175700046226396,
          "y": 0.815865280927023,
          "z": -0.01059005569595766
        },
        {
          "x": -0.07551004207050582,
          "y": 1.0813769460794318,
          "z": -0.01843501340107221
        },
        {
          "x": -0.11783630705390111,
          "y": 1.3464925017091591,
          "z": -0.02367024134063697
        },
        {
          "x": -0.16284505831409188,
          "y": 1.6112018763893579,
          "z": -0.02655770082942648
        },
        {
          "x": -0.21010520205868619,
          "y": 1.875532780344861,
          "z": -0.027468844720247573
        },
        {
          "x": -0.25909069877771146,
          "y": 2.139550262272799,
          "z": -0.026861799825462346
        },
        {
          "x": -0.30921106246126584,
          "y": 2.403350458685747,
          "z": -0.02525441916073391
        },
        {
          "x": -0.3598439673891782,
          "y": 2.6670496150664733,
          "z": -0.023194803046737295
        },
        {
          "x": -0.4103685996653176,
          "y": 2.9307702668177344,
          "z": -0.02123074369583454
        },
        {
          "x": -0.46019865576898084,
          "y": 3.194626889819505,
          "z": -0.019879387824844337
        },
        {
          "x": -0.5088139780887795,
          "y": 3.4587133332473967,
          "z": -0.019598337594351554
        },
        {
          "x": -0.5557897091367862,
          "y": 3.7230939503286766,
          "z": -0.02075944056563296
        },
        {
          "x": -0.6008216304514363,
          "y": 3.9877996051285125,
          "z": -0.023626588204700073
        },
        {
          "x": -0.643746184640245,
          "y": 4.2528287649201575,
          "z": -0.02833883434740784
        }
      ],
      "restLengths": [
        0.268524073698957,
        0.268524073698957,
        0.2685240736989569,
        0.26852407369895714,
        0.268524073698957,
        0.2685240736989571,
        0.2685240736989572,
        0.26852407369895703,
        0.2685240736989571,
        0.2685240736989569,
        0.2685240736989571,
        0.2685240736989571,
        0.2685240736989571,
        0.2685240736989567
      ],
      "activeLength": 3.759337031785398,
      "radius": 0.043,
      "stiffness": 0.7,
      "referenceNormal": {
        "x": 0,
        "y": -0.03980085116764985,
        "z": -0.9992076321997999
      },
      "active": true
    }
  ],
  "organs": [
    {
      "id": "plant-1:leaf-1",
      "kind": "leaf",
      "branchId": "plant-1:petiole-1",
      "distance": 0.22693416768568578,
      "spin": -0.09028746448457242,
      "scale": 0.9370747829973698,
      "active": true
    },
    {
      "id": "plant-1:leaf-2",
      "kind": "leaf",
      "branchId": "plant-1:petiole-2",
      "distance": 0.23347209556726733,
      "spin": 0.09656732372939586,
      "scale": 1.003480158271268,
      "active": true
    },
    {
      "id": "plant-1:leaf-3",
      "kind": "leaf",
      "branchId": "plant-1:petiole-3",
      "distance": 0.23517235056497154,
      "spin": -0.1358431789278984,
      "scale": 0.8556821955785155,
      "active": true
    },
    {
      "id": "plant-1:leaf-4",
      "kind": "leaf",
      "branchId": "plant-1:petiole-4",
      "distance": 0.24309119775891302,
      "spin": 0.08524799972772598,
      "scale": 0.8635873062044382,
      "active": true
    }
  ]
}
