{
  "schemaVersion": 1,
  "generatorVersion": "compact-flower-v1",
  "id": "plant-1",
  "seed": 8278,
  "rootBranchId": "plant-1:stem",
  "branches": [
    {
      "id": "plant-1:pedicel",
      "label": "compact flower stalk",
      "kind": "pedicel",
      "parentId": "plant-1:stem",
      "parentDistance": 3.3274470641813245,
      "points": [
        {
          "x": 0.07701312716348219,
          "y": 3.872595601220646,
          "z": 0.14571430392554974
        },
        {
          "x": 0.07838666835207694,
          "y": 3.9400688618795887,
          "z": 0.22948612116091677
        },
        {
          "x": 0.0797592442212407,
          "y": 4.005985524066372,
          "z": 0.31448820680532286
        },
        {
          "x": 0.08113154918089177,
          "y": 4.071561706286261,
          "z": 0.39975324059305894
        },
        {
          "x": 0.08250453224956876,
          "y": 4.138050257586735,
          "z": 0.484308739206215
        }
      ],
      "restLengths": [
        0.10757436907675595,
        0.10757436907675601,
        0.1075743690767556,
        0.10757436907675592
      ],
      "activeLength": 0.4302974763070235,
      "radius": 0.014,
      "stiffness": 0.18,
      "referenceNormal": {
        "x": -0.999865609072598,
        "y": 0,
        "z": 0.01639401701483908
      },
      "active": true
    },
    {
      "id": "plant-1:petiole-1",
      "label": "leaf stalk",
      "kind": "petiole",
      "parentId": "plant-1:stem",
      "parentDistance": 0.9559633302169892,
      "points": [
        {
          "x": -0.0022454998135119416,
          "y": 1.5047264191424619,
          "z": 0.045733591155686246
        },
        {
          "x": 0.041610327720400526,
          "y": 1.52850768314597,
          "z": 0.09019532033173666
        },
        {
          "x": 0.08575167008701062,
          "y": 1.5511761771886963,
          "z": 0.13495477474666318
        },
        {
          "x": 0.12976722698809406,
          "y": 1.574342498106409,
          "z": 0.17958301483562836
        }
      ],
      "restLengths": [
        0.066826098850773,
        0.06682609885077301,
        0.066826098850773
      ],
      "activeLength": 0.20047829655231902,
      "radius": 0.011,
      "stiffness": 0.18,
      "referenceNormal": {
        "x": -0.7119411255830269,
        "y": 0,
        "z": 0.7022391570566061
      },
      "active": true
    },
    {
      "id": "plant-1:petiole-2",
      "label": "leaf stalk",
      "kind": "petiole",
      "parentId": "plant-1:stem",
      "parentDistance": 1.7205195271343146,
      "points": [
        {
          "x": 0.026244835003338133,
          "y": 2.2680712558690255,
          "z": 0.07749911599326205
        },
        {
          "x": -0.023115945748406686,
          "y": 2.2993260047357076,
          "z": 0.04188220788510002
        },
        {
          "x": -0.07289420312645772,
          "y": 2.3295608505196284,
          "z": 0.005967178452375099
        },
        {
          "x": -0.12248746563611457,
          "y": 2.3602528674059853,
          "z": -0.029815758255255453
        }
      ],
      "restLengths": [
        0.0684244849913132,
        0.06842448499131332,
        0.06842448499131322
      ],
      "activeLength": 0.20527345497393973,
      "radius": 0.011,
      "stiffness": 0.18,
      "referenceNormal": {
        "x": 0.5851391158791769,
        "y": 0,
        "z": -0.8109329288345216
      },
      "active": true
    },
    {
      "id": "plant-1:stem",
      "label": "compact flower stem",
      "kind": "trunk",
      "parentId": null,
      "parentDistance": 0,
      "points": [
        {
          "x": 0,
          "y": 0.55,
          "z": 0
        },
        {
          "x": -0.006628692150267279,
          "y": 0.8268436182466814,
          "z": 0.014208921673925231
        },
        {
          "x": -0.008299057283513527,
          "y": 1.1038004928443657,
          "z": 0.02763730475146836
        },
        {
          "x": -0.005347287600909431,
          "y": 1.3807811749138048,
          "z": 0.040334186052092116
        },
        {
          "x": 0.0015832150722969642,
          "y": 1.6577191556319057,
          "z": 0.05239838710937353
        },
        {
          "x": 0.011595575661324126,
          "y": 1.9345838485518332,
          "z": 0.06397061370854526
        },
        {
          "x": 0.023612673888946955,
          "y": 2.2113820051980184,
          "z": 0.07522191612802123
        },
        {
          "x": 0.03646331116510465,
          "y": 2.488148117214224,
          "z": 0.08633957504089274
        },
        {
          "x": 0.048974475465416854,
          "y": 2.7649275905813067,
          "z": 0.09751167731234747
        },
        {
          "x": 0.06006320035110372,
          "y": 3.041758408951285,
          "z": 0.10891168431632461
        },
        {
          "x": 0.0688218471137585,
          "y": 3.3186571535994354,
          "z": 0.12068424979027234
        },
        {
          "x": 0.07459081888847148,
          "y": 3.5956136452956518,
          "z": 0.13293343958629916
        },
        {
          "x": 0.07701312716348219,
          "y": 3.872595601220646,
          "z": 0.14571430392554974
        }
      ],
      "restLengths": [
        0.2772872553484437,
        0.27728725534844373,
        0.2772872553484437,
        0.2772872553484438,
        0.2772872553484437,
        0.27728725534844356,
        0.2772872553484439,
        0.2772872553484435,
        0.2772872553484439,
        0.2772872553484435,
        0.2772872553484435,
        0.2772872553484438
      ],
      "activeLength": 3.3274470641813245,
      "radius": 0.031,
      "stiffness": 0.46,
      "referenceNormal": {
        "x": 0,
        "y": 0.05125725452519976,
        "z": -0.9986854829517343
      },
      "active": true
    }
  ],
  "organs": [
    {
      "id": "plant-1:bloom",
      "kind": "bloom",
      "branchId": "plant-1:pedicel",
      "distance": 0.4302974763070235,
      "spin": -0.11230104505084455,
      "scale": 1.0168198074458632,
      "active": true
    },
    {
      "id": "plant-1:leaf-1",
      "kind": "leaf",
      "branchId": "plant-1:petiole-1",
      "distance": 0.20047829655231902,
      "spin": -0.12343267627060414,
      "scale": 0.5352184190636035,
      "active": true
    },
    {
      "id": "plant-1:leaf-2",
      "kind": "leaf",
      "branchId": "plant-1:petiole-2",
      "distance": 0.20527345497393973,
      "spin": 0.004204072952270508,
      "scale": 0.4951284999446943,
      "active": true
    }
  ]
}
