{
  "schemaVersion": 1,
  "generatorVersion": "reed-v1",
  "id": "plant-1",
  "seed": 8278,
  "rootBranchId": "plant-1:culm",
  "branches": [
    {
      "id": "plant-1:culm",
      "label": "reed",
      "kind": "trunk",
      "parentId": null,
      "parentDistance": 0,
      "points": [
        {
          "x": 0,
          "y": 0.55,
          "z": 0
        },
        {
          "x": -0.01724803969691387,
          "y": 0.8395486218527037,
          "z": 0.03312537125390093
        },
        {
          "x": -0.032784628554845506,
          "y": 1.1281283062477105,
          "z": 0.0745206568795963
        },
        {
          "x": -0.046666664918580056,
          "y": 1.4155482802293446,
          "z": 0.12381809224582832
        },
        {
          "x": -0.05901628968574511,
          "y": 1.7017026095661312,
          "z": 0.18035459444413554
        },
        {
          "x": -0.07001334313159975,
          "y": 1.9865893443526756,
          "z": 0.24321795952321176
        },
        {
          "x": -0.07988513288407105,
          "y": 2.270315394432031,
          "z": 0.3113007457789541
        },
        {
          "x": -0.0888946446063414,
          "y": 2.5530874317242267,
          "z": 0.3833562322809724
        },
        {
          "x": -0.09732816576183902,
          "y": 2.8351911886114856,
          "z": 0.45805252122432744
        },
        {
          "x": -0.10548295653484321,
          "y": 3.116962673505613,
          "z": 0.5340230365503544
        },
        {
          "x": -0.11365524876136339,
          "y": 3.3987551918307513,
          "z": 0.6099136141383277
        },
        {
          "x": -0.12212860816766553,
          "y": 3.6809059670178974,
          "z": 0.6844275843221741
        },
        {
          "x": -0.13116262133682924,
          "y": 3.963705881949645,
          "z": 0.756370507751452
        },
        {
          "x": -0.1409819689087781,
          "y": 4.247375506184767,
          "z": 0.8246955705795324
        },
        {
          "x": -0.15176616985465075,
          "y": 4.532050044403421,
          "z": 0.8885492925607136
        },
        {
          "x": -0.16364053662450148,
          "y": 4.8177749428941805,
          "z": 0.9473155354826134
        },
        {
          "x": -0.1766690552755072,
          "y": 5.104512488365626,
          "z": 1.0006543321475772
        }
      ],
      "restLengths": [
        0.29194723754626467,
        0.29194723754626456,
        0.29194723754626467,
        0.2919472375462646,
        0.2919472375462647,
        0.29194723754626456,
        0.29194723754626467,
        0.2919472375462646,
        0.2919472375462647,
        0.2919472375462648,
        0.2919472375462645,
        0.29194723754626484,
        0.29194723754626484,
        0.29194723754626467,
        0.2919472375462651,
        0.2919472375462648
      ],
      "activeLength": 4.671155800740235,
      "radius": 0.024,
      "stiffness": 0.56,
      "referenceNormal": {
        "x": 0,
        "y": 0.11366208878102434,
        "z": -0.9935194661273299
      },
      "active": true
    }
  ],
  "organs": []
}
