{
  "schemaVersion": 1,
  "generatorVersion": "nodding-flower-v2",
  "id": "plant-8",
  "seed": 15117,
  "rootBranchId": "plant-8:stem",
  "branches": [
    {
      "id": "plant-8:flower-stalk",
      "label": "flower stalk",
      "kind": "pedicel",
      "parentId": "plant-8:neck",
      "parentDistance": 1.4720270036025338,
      "points": [
        {
          "x": -3.019954422336251,
          "y": 0.5205034203071726,
          "z": 1.2132548812472024
        },
        {
          "x": -3.0452081085431755,
          "y": 0.5575149234492958,
          "z": 1.2174262081491307
        },
        {
          "x": -3.0704617947501003,
          "y": 0.5945264265914202,
          "z": 1.2215975350510593
        }
      ],
      "restLengths": [
        0.045000000000000026,
        0.045000000000000026
      ],
      "activeLength": 0.09000000000000005,
      "radius": 0.013,
      "stiffness": 0.18,
      "referenceNormal": {
        "x": 0.3635352621964267,
        "y": 0.1443225631760587,
        "z": 0.9203331521237665
      },
      "active": true
    },
    {
      "id": "plant-8:neck",
      "label": "arching upper stem",
      "kind": "lateral",
      "parentId": "plant-8:stem",
      "parentDistance": 2.3816415361687544,
      "points": [
        {
          "x": -2.8791339853922615,
          "y": -0.22915380522565487,
          "z": 0.3529717730919216
        },
        {
          "x": -3.021403059232748,
          "y": -0.30754246432679755,
          "z": 0.37175686293412624
        },
        {
          "x": -3.154660968410362,
          "y": -0.29481230258676017,
          "z": 0.45541949018797134
        },
        {
          "x": -3.208491623322927,
          "y": -0.19351382834353947,
          "z": 0.571271107056462
        },
        {
          "x": -3.2155161470286155,
          "y": -0.07357889892208302,
          "z": 0.6835305505530809
        },
        {
          "x": -3.1996331651317695,
          "y": 0.0491338643022049,
          "z": 0.7920707285156934
        },
        {
          "x": -3.169244463225582,
          "y": 0.17104457998856315,
          "z": 0.8984617899920442
        },
        {
          "x": -3.1280486620918473,
          "y": 0.29076410594181734,
          "z": 1.003720131673603
        },
        {
          "x": -3.0779386364936814,
          "y": 0.40747179937095623,
          "z": 1.1085018357997223
        },
        {
          "x": -3.019954422336251,
          "y": 0.5205034203071726,
          "z": 1.2132548812472024
        }
      ],
      "restLengths": [
        0.16351804440943085,
        0.15785804564650027,
        0.16303593905444186,
        0.16442601340053223,
        0.16459544830957915,
        0.1646352142306375,
        0.16464864839734883,
        0.164653897283278,
        0.16465575287078502
      ],
      "activeLength": 1.4720270036025338,
      "radius": 0.022,
      "stiffness": 0.62,
      "referenceNormal": {
        "x": -0.12774925785985244,
        "y": -0.0058182518742657535,
        "z": -0.9917894308074596
      },
      "active": true
    },
    {
      "id": "plant-8:petiole",
      "label": "leaf stalk",
      "kind": "petiole",
      "parentId": "plant-8:stem",
      "parentDistance": 0.7763063842368476,
      "points": [
        {
          "x": -1.5090820997833623,
          "y": 0.5683644066228108,
          "z": 0.33197988656998756
        },
        {
          "x": -1.5361690837297988,
          "y": 0.5249088908499634,
          "z": 0.3844745646562381
        },
        {
          "x": -1.561175887818098,
          "y": 0.4809449271979918,
          "z": 0.43757454042906985
        },
        {
          "x": -1.5871098983942842,
          "y": 0.43720190246937524,
          "z": 0.4904115791500625
        }
      ],
      "restLengths": [
        0.07333333333333329,
        0.07333333333333329,
        0.07333333333333333
      ],
      "activeLength": 0.21999999999999992,
      "radius": 0.012,
      "stiffness": 0.18,
      "referenceNormal": {
        "x": 0.08054517241154634,
        "y": -0.7878263075945497,
        "z": -0.6106080447088231
      },
      "active": true
    },
    {
      "id": "plant-8:stem",
      "label": "supporting stem",
      "kind": "trunk",
      "parentId": null,
      "parentDistance": 0,
      "points": [
        {
          "x": -0.7336833627848393,
          "y": 0.5499999999999998,
          "z": 0.3071758454240907
        },
        {
          "x": -0.9319653024224965,
          "y": 0.5566666666666665,
          "z": 0.3126730886425086
        },
        {
          "x": -1.1301754124216326,
          "y": 0.564704634796674,
          "z": 0.3188807513580486
        },
        {
          "x": -1.3283541663278682,
          "y": 0.5730036007733824,
          "z": 0.3257145188261153
        },
        {
          "x": -1.5266398998434283,
          "y": 0.5679137068235147,
          "z": 0.33258856986562646
        },
        {
          "x": -1.7214687764945533,
          "y": 0.5305418586486377,
          "z": 0.3385421822793735
        },
        {
          "x": -1.9047779008816583,
          "y": 0.45458559900733075,
          "z": 0.3428784539099158
        },
        {
          "x": -2.073775882351057,
          "y": 0.3505567417279748,
          "z": 0.34571937389091834
        },
        {
          "x": -2.235823581675876,
          "y": 0.2359862375700159,
          "z": 0.3478487950429925
        },
        {
          "x": -2.397303535751164,
          "y": 0.1206126812277899,
          "z": 0.34973523155356195
        },
        {
          "x": -2.5584125852563435,
          "y": 0.004716634525809393,
          "z": 0.3512754394319163
        },
        {
          "x": -2.7190430344177363,
          "y": -0.11184686090748797,
          "z": 0.3523718191559978
        },
        {
          "x": -2.8791339853922615,
          "y": -0.22915380522565487,
          "z": 0.3529717730919216
        }
      ],
      "restLengths": [
        0.19847012801406277,
        0.19847012801406286,
        0.19847012801406289,
        0.19847012801406275,
        0.1984701280140628,
        0.19847012801406289,
        0.19847012801406275,
        0.19847012801406289,
        0.198470128014063,
        0.19847012801406277,
        0.1984701280140629,
        0.19847012801406297
      ],
      "activeLength": 2.3816415361687544,
      "radius": 0.031,
      "stiffness": 0.48,
      "referenceNormal": {
        "x": -0.025419097153841136,
        "y": 0.06647344560598444,
        "z": -0.997464360530817
      },
      "active": true
    }
  ],
  "organs": [
    {
      "id": "plant-8:bloom",
      "kind": "bloom",
      "branchId": "plant-8:flower-stalk",
      "distance": 0.09000000000000005,
      "spin": -0.1563865221454762,
      "scale": 1.1390467099519448,
      "active": true
    },
    {
      "id": "plant-8:leaf",
      "kind": "leaf",
      "branchId": "plant-8:petiole",
      "distance": 0.21999999999999992,
      "spin": 0.35,
      "scale": 0.5228549537761137,
      "active": true
    }
  ]
}
