{
  "schemaVersion": 1,
  "generatorVersion": "nodding-flower-v1",
  "id": "plant-1",
  "seed": 8278,
  "rootBranchId": "plant-1:stem",
  "branches": [
    {
      "id": "plant-1:neck",
      "label": "flower neck",
      "kind": "pedicel",
      "parentId": "plant-1:stem",
      "parentDistance": 2.1176022190712387,
      "points": [
        {
          "x": -0.0436976567601535,
          "y": 2.662596651067995,
          "z": 0.13804290685557902
        },
        {
          "x": -0.059259768782698945,
          "y": 2.8060652553775496,
          "z": 0.20211434297569386
        },
        {
          "x": -0.09206223416879553,
          "y": 2.846081215851868,
          "z": 0.3531081548554308
        },
        {
          "x": -0.12313114116138912,
          "y": 2.818060736893214,
          "z": 0.5100911127013563
        },
        {
          "x": -0.15047465273476066,
          "y": 2.7628726046744805,
          "z": 0.6607528418102229
        },
        {
          "x": -0.17460079653674218,
          "y": 2.6931164753004584,
          "z": 0.805887091772414
        },
        {
          "x": -0.19588047250621962,
          "y": 2.6138374322718803,
          "z": 0.9465291202964337
        },
        {
          "x": -0.21452678082750107,
          "y": 2.527557665723091,
          "z": 1.0833826493846603
        },
        {
          "x": -0.230652392799326,
          "y": 2.4357224804423527,
          "z": 1.2169053493846642
        },
        {
          "x": -0.24430483868365577,
          "y": 2.3392371795786064,
          "z": 1.3473926669684757
        }
      ],
      "restLengths": [
        0.1578941692388538,
        0.15961331415036042,
        0.16246252883924472,
        0.16276472032055658,
        0.16282487190870742,
        0.16284400959275183,
        0.1628519921696629,
        0.16285591187397666,
        0.16285804435645995
      ],
      "activeLength": 1.4569695624505743,
      "radius": 0.015,
      "stiffness": 0.18,
      "referenceNormal": {
        "x": 0,
        "y": 0.4077726369151771,
        "z": -0.9130834992393866
      },
      "active": true
    },
    {
      "id": "plant-1:petiole",
      "label": "leaf stalk",
      "kind": "petiole",
      "parentId": "plant-1:stem",
      "parentDistance": 0.775566585685814,
      "points": [
        {
          "x": -0.013915817002975558,
          "y": 1.3241044127044033,
          "z": 0.04530768460796837
        },
        {
          "x": 0.050388084434956404,
          "y": 1.3546363750850998,
          "z": 0.06293111534157522
        },
        {
          "x": 0.11559602781467884,
          "y": 1.3831404216602223,
          "z": 0.08062917248940732
        },
        {
          "x": 0.18040960416298396,
          "y": 1.4125489032924843,
          "z": 0.09829607110815518
        }
      ],
      "restLengths": [
        0.07333333333333332,
        0.07333333333333329,
        0.07333333333333335
      ],
      "activeLength": 0.21999999999999997,
      "radius": 0.012,
      "stiffness": 0.18,
      "referenceNormal": {
        "x": -0.264317784244419,
        "y": 0,
        "z": 0.9644356427113843
      },
      "active": true
    },
    {
      "id": "plant-1:stem",
      "label": "supporting stem",
      "kind": "trunk",
      "parentId": null,
      "parentDistance": 0,
      "points": [
        {
          "x": 0,
          "y": 0.55,
          "z": 0
        },
        {
          "x": -0.0029521903938960485,
          "y": 0.7457952401549289,
          "z": 0.010031530446883057
        },
        {
          "x": -0.006307990043027083,
          "y": 0.9415293443777555,
          "z": 0.021077894163392043
        },
        {
          "x": -0.010040103825048108,
          "y": 1.137200943069825,
          "z": 0.033070387255429864
        },
        {
          "x": -0.014096431730441927,
          "y": 1.3328144275276932,
          "z": 0.04587796316698073
        },
        {
          "x": -0.018404195610270853,
          "y": 1.5283801246839326,
          "z": 0.059317619587608686
        },
        {
          "x": -0.022875706598226502,
          "y": 1.7239134229180182,
          "z": 0.07316890002443223
        },
        {
          "x": -0.027415351915045544,
          "y": 1.9194329431172752,
          "z": 0.08719145114769855
        },
        {
          "x": -0.03192724455483885,
          "y": 2.1149580964984724,
          "z": 0.10114424006680472
        },
        {
          "x": -0.0363229053658206,
          "y": 2.310506527730098,
          "z": 0.11480485159923205
        },
        {
          "x": -0.040528345201267364,
          "y": 2.506091958997754,
          "z": 0.12798728120041492
        },
        {
          "x": -0.04448998464987504,
          "y": 2.7017228240855555,
          "z": 0.14055681326937006
        },
        {
          "x": -0.048178978874076975,
          "y": 2.897401854473188,
          "z": 0.15244089870849942
        }
      ],
      "restLengths": [
        0.19607427954363324,
        0.19607427954363327,
        0.19607427954363332,
        0.19607427954363318,
        0.1960742795436332,
        0.19607427954363316,
        0.19607427954363316,
        0.19607427954363332,
        0.19607427954363338,
        0.19607427954363305,
        0.19607427954363313,
        0.19607427954363305
      ],
      "activeLength": 2.3528913545235985,
      "radius": 0.031,
      "stiffness": 0.48,
      "referenceNormal": {
        "x": 0,
        "y": 0.05116768872985036,
        "z": -0.9986900758644021
      },
      "active": true
    }
  ],
  "organs": [
    {
      "id": "plant-1:bloom",
      "kind": "bloom",
      "branchId": "plant-1:neck",
      "distance": 1.4569695624505743,
      "spin": -0.09027904432732613,
      "scale": 1.0742289858311416,
      "active": true
    },
    {
      "id": "plant-1:leaf",
      "kind": "leaf",
      "branchId": "plant-1:petiole",
      "distance": 0.21999999999999997,
      "spin": -0.35,
      "scale": 0.5543211004091426,
      "active": true
    }
  ]
}
