{
  "schemaVersion": 1,
  "generatorVersion": "bare-branch-v1",
  "id": "plant-1",
  "seed": 8278,
  "rootBranchId": "plant-1:trunk",
  "branches": [
    {
      "id": "plant-1:answering",
      "label": "answering fork",
      "kind": "lateral",
      "parentId": "plant-1:trunk",
      "parentDistance": 1.711023830885382,
      "points": [
        {
          "x": 0.275703599398612,
          "y": 2.2358976655262337,
          "z": -0.06949945172741818
        },
        {
          "x": 0.5184708190955188,
          "y": 2.277650472981576,
          "z": -0.014523546484103929
        },
        {
          "x": 0.7621093266015968,
          "y": 2.3131328822447212,
          "z": 0.04099983904113592
        },
        {
          "x": 1.0063127168339554,
          "y": 2.3437790033360946,
          "z": 0.09692022448478502
        },
        {
          "x": 1.2508171403048942,
          "y": 2.3714548885201983,
          "z": 0.15307360665817754
        },
        {
          "x": 1.4954101799169695,
          "y": 2.3981843286745153,
          "z": 0.20929950860250907
        },
        {
          "x": 1.7399083417184649,
          "y": 2.4259256971935956,
          "z": 0.26544784246442654
        },
        {
          "x": 1.9841343532159335,
          "y": 2.4563600003900636,
          "z": 0.32138511576296014
        },
        {
          "x": 2.2279202174021013,
          "y": 2.49065449372653,
          "z": 0.3770080444604798
        }
      ],
      "restLengths": [
        0.2523916996398475,
        0.2523916996398474,
        0.25239169963984753,
        0.25239169963984737,
        0.2523916996398475,
        0.2523916996398475,
        0.2523916996398476,
        0.2523916996398475
      ],
      "activeLength": 2.01913359711878,
      "radius": 0.044,
      "stiffness": 0.66,
      "referenceNormal": {
        "x": -0.22086288301930004,
        "y": 0,
        "z": 0.9753048686971695
      },
      "active": true
    },
    {
      "id": "plant-1:counter",
      "label": "counter fork",
      "kind": "lateral",
      "parentId": "plant-1:trunk",
      "parentDistance": 3.0960461915734876,
      "points": [
        {
          "x": 0.6218571015487842,
          "y": 3.5751938056717907,
          "z": -0.1362208098449794
        },
        {
          "x": 0.5050206682308213,
          "y": 3.7311723026672565,
          "z": -0.1679028717031109
        },
        {
          "x": 0.38482174765910815,
          "y": 3.884470445713156,
          "z": -0.20008509585067052
        },
        {
          "x": 0.2621454599923095,
          "y": 4.035715504996937,
          "z": -0.23263132766862554
        },
        {
          "x": 0.1382351357034774,
          "y": 4.185912150121381,
          "z": -0.2653574036174472
        },
        {
          "x": 0.014437778768060627,
          "y": 4.336205495487899,
          "z": -0.2980670577482304
        },
        {
          "x": -0.10804560322910083,
          "y": 4.487612878636121,
          "z": -0.3305850863132412
        },
        {
          "x": -0.2283979066421894,
          "y": 4.640785871931638,
          "z": -0.3627899602776732
        }
      ],
      "restLengths": [
        0.19744314806801935,
        0.1974431480680194,
        0.1974431480680191,
        0.19744314806801908,
        0.1974431480680196,
        0.19744314806801921,
        0.19744314806801913
      ],
      "activeLength": 1.382102036476135,
      "radius": 0.036,
      "stiffness": 0.6,
      "referenceNormal": {
        "x": 0.2617145440430171,
        "y": 0,
        "z": -0.965145324516653
      },
      "active": true
    },
    {
      "id": "plant-1:distal",
      "label": "distal fork",
      "kind": "twig",
      "parentId": "plant-1:trunk",
      "parentDistance": 4.276998158090769,
      "points": [
        {
          "x": 0.9218479646945908,
          "y": 4.7159201537962145,
          "z": -0.19351690904039742
        },
        {
          "x": 1.0586812785616937,
          "y": 4.81008456514313,
          "z": -0.1553683114175592
        },
        {
          "x": 1.1977520549722611,
          "y": 4.9004875832677275,
          "z": -0.11622471537326094
        },
        {
          "x": 1.3382406925807941,
          "y": 4.988384613185535,
          "z": -0.07644202462364266
        },
        {
          "x": 1.479105504252513,
          "y": 5.075599482737223,
          "z": -0.036488564066054344
        },
        {
          "x": 1.6193357091301557,
          "y": 5.163960852583796,
          "z": 0.0031771088459879304
        },
        {
          "x": 1.7581883814173545,
          "y": 5.25474058987554,
          "z": 0.04222300933117609
        }
      ],
      "restLengths": [
        0.17042771971939735,
        0.1704277197193974,
        0.17042771971939735,
        0.17042771971939752,
        0.17042771971939777,
        0.1704277197193977
      ],
      "activeLength": 1.0225663183163851,
      "radius": 0.028,
      "stiffness": 0.5,
      "referenceNormal": {
        "x": -0.26855441388419987,
        "y": 0,
        "z": 0.9632645154802049
      },
      "active": true
    },
    {
      "id": "plant-1:spur",
      "label": "restrained spur",
      "kind": "twig",
      "parentId": "plant-1:answering",
      "parentDistance": 1.0116185126854842,
      "points": [
        {
          "x": 1.2528054584438528,
          "y": 2.3716721744690843,
          "z": 0.1535306719160137
        },
        {
          "x": 1.2925453665450102,
          "y": 2.442825027783579,
          "z": 0.2566409741407444
        },
        {
          "x": 1.3314991352961587,
          "y": 2.512599419854016,
          "z": 0.3609858895264052
        },
        {
          "x": 1.370055710554763,
          "y": 2.5816772210019545,
          "z": 0.4659400278366745
        },
        {
          "x": 1.4087101196969045,
          "y": 2.650926609418449,
          "z": 0.57074499963368
        },
        {
          "x": 1.4478514288557944,
          "y": 2.721029876621909,
          "z": 0.6747988948048183
        }
      ],
      "restLengths": [
        0.13142953722644593,
        0.13142953722644582,
        0.13142953722644587,
        0.13142953722644587,
        0.13142953722644587
      ],
      "activeLength": 0.6571476861322294,
      "radius": 0.02,
      "stiffness": 0.42,
      "referenceNormal": {
        "x": -0.9330964519955969,
        "y": 0,
        "z": 0.3596262104925457
      },
      "active": true
    },
    {
      "id": "plant-1:trunk",
      "label": "main line",
      "kind": "trunk",
      "parentId": null,
      "parentDistance": 0,
      "points": [
        {
          "x": 0,
          "y": 0.55,
          "z": 0
        },
        {
          "x": 0.03640129000145639,
          "y": 0.8945833728426027,
          "z": -0.012398856265706412
        },
        {
          "x": 0.08325334439108664,
          "y": 1.237867796958106,
          "z": -0.025709586869632095
        },
        {
          "x": 0.14014733829652853,
          "y": 1.5795965216083787,
          "z": -0.039888394874455196
        },
        {
          "x": 0.20628676977631574,
          "y": 1.9196228944372191,
          "z": -0.054859292457595646
        },
        {
          "x": 0.28054120250623593,
          "y": 2.257938600322712,
          "z": -0.07051971266939955
        },
        {
          "x": 0.36151342303382694,
          "y": 2.5946828155751707,
          "z": -0.08674683154149815
        },
        {
          "x": 0.44761228654974056,
          "y": 2.9301317901685446,
          "z": -0.10340388817146773
        },
        {
          "x": 0.5371252349746793,
          "y": 3.264671596872491,
          "z": -0.12034603044487958
        },
        {
          "x": 0.6282872581208239,
          "y": 3.598758805504868,
          "z": -0.1374255197282434
        },
        {
          "x": 0.7193457950478943,
          "y": 3.9328746752271027,
          "z": -0.15449639675632243
        },
        {
          "x": 0.8086228818856214,
          "y": 4.267478497469842,
          "z": -0.17141887578187376
        },
        {
          "x": 0.8945763303601614,
          "y": 4.602965365545767,
          "z": -0.18806376791108276
        },
        {
          "x": 0.9758608728989053,
          "y": 4.939633061288042,
          "z": -0.2043171422655473
        },
        {
          "x": 1.0513883865745375,
          "y": 5.2776618293376565,
          "z": -0.22008524420867828
        },
        {
          "x": 1.1203841385348043,
          "y": 5.617109322210236,
          "z": -0.235299454145744
        },
        {
          "x": 1.1824342754165946,
          "y": 5.957920826525617,
          "z": -0.2499208572689157
        }
      ],
      "restLengths": [
        0.34672249190101856,
        0.3467224919010186,
        0.3467224919010187,
        0.3467224919010186,
        0.3467224919010187,
        0.3467224919010189,
        0.3467224919010187,
        0.3467224919010187,
        0.3467224919010189,
        0.3467224919010185,
        0.3467224919010186,
        0.34672249190101834,
        0.3467224919010189,
        0.3467224919010186,
        0.34672249190101867,
        0.34672249190101895
      ],
      "activeLength": 5.547559870416299,
      "radius": 0.078,
      "stiffness": 0.86,
      "referenceNormal": {
        "x": 0,
        "y": -0.03595889566135098,
        "z": -0.9993532697814203
      },
      "active": true
    }
  ],
  "organs": []
}
