{
  "schemaVersion": 1,
  "generatorVersion": "arching-trailer-v1",
  "id": "plant-1",
  "seed": 8278,
  "rootBranchId": "plant-1:trail",
  "branches": [
    {
      "id": "plant-1:petiole-1",
      "label": "leaf stalk",
      "kind": "petiole",
      "parentId": "plant-1:trail",
      "parentDistance": 1.4905887078880196,
      "points": [
        {
          "x": -0.9642889562760641,
          "y": 1.3436866812309414,
          "z": 0.17139171335380438
        },
        {
          "x": -0.9798458722668435,
          "y": 1.3702975245776645,
          "z": 0.12601404551247436
        },
        {
          "x": -0.9936866139762411,
          "y": 1.3972122618789171,
          "z": 0.08026125169150229
        },
        {
          "x": -1.0082870229104322,
          "y": 1.4239963046938096,
          "z": 0.03466815498892588
        }
      ],
      "restLengths": [
        0.05485697182205815,
        0.054856971822058107,
        0.054856971822058134
      ],
      "activeLength": 0.1645709154661744,
      "radius": 0.012,
      "stiffness": 0.18,
      "referenceNormal": {
        "x": 0.9459532465006083,
        "y": 0,
        "z": -0.32430303025867513
      },
      "active": true
    },
    {
      "id": "plant-1:petiole-2",
      "label": "leaf stalk",
      "kind": "petiole",
      "parentId": "plant-1:trail",
      "parentDistance": 1.9427358286882417,
      "points": [
        {
          "x": -1.3896293787908114,
          "y": 1.2102382732071881,
          "z": 0.24152069853877073
        },
        {
          "x": -1.3960528222922106,
          "y": 1.2537702405155615,
          "z": 0.282566505206863
        },
        {
          "x": -1.4006805267583928,
          "y": 1.2979084221449046,
          "z": 0.32320461937344525
        },
        {
          "x": -1.4060997421125025,
          "y": 1.341785247727121,
          "z": 0.3640274969173044
        }
      ],
      "restLengths": [
        0.06017516970634453,
        0.06017516970634465,
        0.06017516970634464
      ],
      "activeLength": 0.18052550911903384,
      "radius": 0.012,
      "stiffness": 0.18,
      "referenceNormal": {
        "x": -0.9879751595164297,
        "y": 0,
        "z": -0.1546126908713678
      },
      "active": true
    },
    {
      "id": "plant-1:petiole-3",
      "label": "leaf stalk",
      "kind": "petiole",
      "parentId": "plant-1:trail",
      "parentDistance": 2.3698865299484595,
      "points": [
        {
          "x": -1.7678047688028116,
          "y": 1.0219788787388033,
          "z": 0.30233085386151937
        },
        {
          "x": -1.766722916504579,
          "y": 1.0327380337508623,
          "z": 0.23855752908211492
        },
        {
          "x": -1.7638895112586628,
          "y": 1.0444653750836763,
          "z": 0.17500905896391156
        },
        {
          "x": -1.7618250454367823,
          "y": 1.0557688916155028,
          "z": 0.11135424556167844
        }
      ],
      "restLengths": [
        0.06468358968384566,
        0.06468358968384562,
        0.06468358968384566
      ],
      "activeLength": 0.19405076905153693,
      "radius": 0.012,
      "stiffness": 0.18,
      "referenceNormal": {
        "x": 0.999856141970611,
        "y": 0,
        "z": 0.016961584939071007
      },
      "active": true
    },
    {
      "id": "plant-1:trail",
      "label": "trailing cane",
      "kind": "trunk",
      "parentId": null,
      "parentDistance": 0,
      "points": [
        {
          "x": 0,
          "y": 0.55,
          "z": 0
        },
        {
          "x": -0.015122458270082371,
          "y": 0.7168820605935238,
          "z": 0.004017236996025553
        },
        {
          "x": -0.05049760976656405,
          "y": 0.8804796920491921,
          "z": 0.011508087756894683
        },
        {
          "x": -0.1126885387008417,
          "y": 1.0354490404256687,
          "z": 0.023546011617963773
        },
        {
          "x": -0.2079173539185379,
          "y": 1.171782088295114,
          "z": 0.0410926790045696
        },
        {
          "x": -0.33636719592134656,
          "y": 1.2761769446101148,
          "z": 0.06402725324392214
        },
        {
          "x": -0.4883964578952476,
          "y": 1.3405358339913236,
          "z": 0.09058308056558649
        },
        {
          "x": -0.651216613332712,
          "y": 1.3675712034901437,
          "z": 0.11856324645199334
        },
        {
          "x": -0.816377607018675,
          "y": 1.3653522605302666,
          "z": 0.14657887621264906
        },
        {
          "x": -0.979973590947696,
          "y": 1.3413892463284454,
          "z": 0.1740228859289966
        },
        {
          "x": -1.140501545994121,
          "y": 1.3011045691728154,
          "z": 0.20068299688160926
        },
        {
          "x": -1.2974727445146754,
          "y": 1.2481670938844203,
          "z": 0.226504208918654
        },
        {
          "x": -1.4507914765344458,
          "y": 1.1850658452449143,
          "z": 0.25148677437396083
        },
        {
          "x": -1.6004891303681903,
          "y": 1.113500330452097,
          "z": 0.27564355947206426
        },
        {
          "x": -1.7466197622726394,
          "y": 1.0346534964529719,
          "z": 0.2989844100798681
        },
        {
          "x": -1.8892088383661054,
          "y": 0.9493449539643387,
          "z": 0.321508185389769
        },
        {
          "x": -2.0282298155032668,
          "y": 0.8581331564155029,
          "z": 0.3431990767489283
        },
        {
          "x": -2.163584303858312,
          "y": 0.7613725180534389,
          "z": 0.364022705943678
        },
        {
          "x": -2.295080120458271,
          "y": 0.6592455569142476,
          "z": 0.3839211498289199
        }
      ],
      "restLengths": [
        0.1676139883337699,
        0.16754611068725322,
        0.16741601532954675,
        0.1672217471667928,
        0.16710368826305583,
        0.16721296332357058,
        0.1674043126793591,
        0.16753493084751028,
        0.16760383550698402,
        0.16763902016215082,
        0.16765759286698223,
        0.1676679150724539,
        0.16767397155541017,
        0.1676776076868196,
        0.16767979155799925,
        0.16768100328962668,
        0.16768149029314672,
        0.16768128710106575
      ],
      "activeLength": 3.015697271723498,
      "radius": 0.031,
      "stiffness": 0.5,
      "referenceNormal": {
        "x": 0,
        "y": 0.024065340161504276,
        "z": -0.9997103877638319
      },
      "active": true
    }
  ],
  "organs": [
    {
      "id": "plant-1:leaf-1",
      "kind": "leaf",
      "branchId": "plant-1:petiole-1",
      "distance": 0.1645709154661744,
      "spin": 0.07826719423756004,
      "scale": 0.44697306767106054,
      "active": true
    },
    {
      "id": "plant-1:leaf-2",
      "kind": "leaf",
      "branchId": "plant-1:petiole-2",
      "distance": 0.18052550911903384,
      "spin": -0.16844000034034254,
      "scale": 0.46089947439730167,
      "active": true
    },
    {
      "id": "plant-1:leaf-3",
      "kind": "leaf",
      "branchId": "plant-1:petiole-3",
      "distance": 0.19405076905153693,
      "spin": 0.07712197825312615,
      "scale": 0.4340107572637498,
      "active": true
    }
  ]
}
